{
  "schemaVersion": "e2.9-r5-preview-activation-3.3.0",
  "protocolVersion": "e2-9-v4-pro-protocol-3.3.0",
  "runId": "e29r5-run-20260813-a",
  "runLabel": "e29r5-20260813-a",
  "runManifestSha256": "590373a478a266df0440c9005b58718686d8dc3c47ad677d24e66ced82a5a8ab",
  "protocolBundleSha256": "d6b4729b4a80582363cd112d2143d24a347d96dc635e8dca7ac4400b2b7c0b1b",
  "deploymentSourceCommit": "2c91384515ac559fc943628b22179d8b3884c003",
  "mainWorker": "student-affairs-manager-preview",
  "ledgerWorker": "student-affairs-e2-r5-ledger-preview",
  "previewOrigin": "https://student-affairs-manager-preview.nightsdell.workers.dev",
  "ledgerDeploymentVersion": "df36beb2-f825-47a1-ad49-df588a2960b7",
  "disabledCodeDeploymentVersion": "272d4970-8355-494a-ae30-76c338586b5c",
  "secretChangeVersion": "d05f0ae9-e5e2-424a-853d-29d7730880d6",
  "mainDeploymentVersion": "6d4d09db-074f-44fd-8832-ed5ad83ee2d2",
  "deploymentChain": [
    {
      "kind": "R5_LEDGER_UPLOAD",
      "version": "df36beb2-f825-47a1-ad49-df588a2960b7",
      "createdAt": "2026-08-13T13:38:11.354277Z"
    },
    {
      "kind": "R5_PREVIEW_DISABLED_CODE_DEPLOYMENT",
      "version": "272d4970-8355-494a-ae30-76c338586b5c",
      "createdAt": "2026-08-13T13:38:55.429052Z"
    },
    {
      "kind": "R5_TEMP_BEARER_SECRET_CHANGE",
      "version": "d05f0ae9-e5e2-424a-853d-29d7730880d6",
      "createdAt": "2026-08-13T13:51:02.02516Z"
    },
    {
      "kind": "R5_PREVIEW_ACTIVATION_DEPLOYMENT",
      "version": "6d4d09db-074f-44fd-8832-ed5ad83ee2d2",
      "createdAt": "2026-08-13T13:51:23.313874Z"
    }
  ],
  "featureFlag": true,
  "productionFeatureFlag": false,
  "productionBaselineVersion": "3b6d6ba2-e21f-495c-80e4-c4bac62366be",
  "secretName": "E2_R5_BENCHMARK_TOKEN",
  "secretPolicy": "Random 256-bit bearer held only in process memory; never written to disk or Git.",
  "activatedAt": "2026-08-13T13:51:36.2813536Z",
  "status": "READINESS_AUTHORIZED"
}
